experiment_id	timestamp	status	decision	val_fvu	k	architecture	expansion_factor	wall_time_sec	peak_memory_gb	total_tokens	checkpoint	head_commit	head_branch	workspace_dirty	description	self_review	log_path
r1_1774523552	1774523552	ok	keep	0.16425763070583344	128	topk	12				/root/sparsify-ascend/checkpoints/research_agent/round_0001/round0001_standard_1774523312_dp2_bs1_ga8_ef12_k128_20260326_190838	4ccce2a53a68f3b5743408dec07209ecc2fad9e2			执行主线 topk 参考配方的 clean baseline，不开新 family，不改代码，不先动 K。用完整 env_overrides 显式锁定 ARCHITECTURE=topk、K=128、EXPANSION_FACTOR=12、OPTIMIZER=signum、LR=8e-4 及其余关键运行参数，优先消除变量隔离失效风险，并建立 round 1 的可比较基线。	这轮不是为了直接拿更低 FVU，而是为了建立干净基线。风险是收益偏信息获取而非性能提升，但这符合当前“frontier 为空先补 clean baseline”的主线策略，也避免在没有曲线参考时过早调 lr 或换优化器。	/root/sparsify-ascend/research/history/logs/round0001_standard_1774523312.log
r2_1774523810	1774523810	ok	discard	0.17248131334781647	128	topk	12				/root/sparsify-ascend/checkpoints/research_agent/round_0002/round0002_standard_1774523570_dp2_bs1_ga8_ef12_k128_20260326_191257	c3d2f65e70de4e209899271789bfa997ea727b3f			继续主线 topk，不开新 family，不换优化器，不动 K。本轮唯一主变量是学习率：从 8e-4 下调到 6e-4，回答“当前 signum+topk 基线是否因 LR 略大而限制了收敛质量”这个单一问题。	这是按主线顺序进行的单变量 LR 回调，归因清晰。风险是收益可能有限，但相比直接换优化器或改 K，这一轮更符合当前策略，也更容易结合训练曲线判断是过冲/震荡还是单纯欠训练。	/root/sparsify-ascend/research/history/logs/round0002_standard_1774523570.log
r3_1774524188	1774524188	ok	keep	0.1592891961336136	128	topk	12				/root/sparsify-ascend/checkpoints/research_agent/round_0003/round0003_standard_1774523828_dp2_bs1_ga8_ef12_k128_20260326_191714	e9900142fd7ed9ace994b454ab3d7f7298cec2f2			继续围绕 topk 主线推进，不开新 family，不换优化器，不动 K。本轮唯一主变量仍是 LR：从参考配方 8e-4 上调到 1e-3，回答“signum+topk 在当前设置下是否更需要稍大的学习率”这个单一问题。	这轮保持单变量且遵循主线顺序，先把 LR 维度补全到高于 baseline 的一侧，再决定是否切 optimizer。风险是 1e-3 可能带来震荡，但这正是本轮要验证的核心问题；若曲线恶化，后续就有充分理由结束 signum 的 LR 扫描并转向 optimizer 对比。	/root/sparsify-ascend/research/history/logs/round0003_standard_1774523828.log
r4_1774524451	1774524451	ok	keep	0.1560375690460205	128	topk	12				/root/sparsify-ascend/checkpoints/research_agent/round_0004/round0004_standard_1774524211_dp2_bs1_ga8_ef12_k128_20260326_192338	38471667da563c651cc62430e78da06f281fae61			继续围绕 topk 主线推进，不开新 family，不换优化器，不动 K。本轮唯一主变量是学习率：从 1e-3 小幅上调到 1.2e-3，回答“signum+topk 的更优 LR 是否在 1e-3 之上”这个单一问题。	这轮仍然严格遵守单变量原则，并延续当前最强主线配方做局部 LR 外推，归因清晰。风险是 1.2e-3 可能开始带来震荡或后段恶化，但这正是当前最该确认的信息；若出现不稳，就有充分依据结束 signum 的 LR 扫描并转向 optimizer 维度。	/root/sparsify-ascend/research/history/logs/round0004_standard_1774524211.log
r5_1774524774	1774524774	ok	keep	0.153762549161911	128	topk	12				/root/sparsify-ascend/checkpoints/research_agent/round_0005/round0005_standard_1774524474_dp2_bs1_ga8_ef12_k128_20260326_192800	f5652278b055b478e4b29c3e626de0456383d301			继续围绕 topk 主线推进，不开新 family，不换优化器，不动 K。本轮唯一主变量仍是学习率：从 1.2e-3 上调到 1.4e-3，回答“signum+topk 的更优 LR 是否仍在 1.2e-3 以上”这个单一问题。	这轮仍然保持单变量和主线顺序，继续在已改善的方向上做最小外推，归因清晰。风险是 LR 继续增大可能引入震荡，但当前连续两轮上调均有收益，继续上探一小步比过早切 optimizer 更符合证据。若本轮不再改善，就可以较有把握地结束 signum 的 LR 扫描。	/root/sparsify-ascend/research/history/logs/round0005_standard_1774524474.log
r6_1774525100	1774525100	ok	keep	0.15245991945266724	128	topk	12				/root/sparsify-ascend/checkpoints/research_agent/round_0006/round0006_standard_1774524799_dp2_bs1_ga8_ef12_k128_20260326_193326	be8588ccf0641c58d1e152cd49f4d74bfde0d6f3			继续围绕 topk 主线推进，不开新 family，不换优化器，不动 K。本轮唯一主变量仍是学习率：从 1.4e-3 上调到 1.6e-3，回答“signum+topk 的更优 LR 是否仍在 1.4e-3 以上”这个单一问题。	这轮继续沿当前最强主线做最小幅度的 LR 外推，符合单变量原则，也符合先完成学习率扫描再切 optimizer 的顺序。风险是继续加大学习率可能引入不稳定，但当前连续三轮上调都改善了结果，因此再上探一档是信息收益最高的动作；若本轮不再改善，就可以较有把握地结束 signum 的 LR 扫描。	/root/sparsify-ascend/research/history/logs/round0006_standard_1774524799.log
r7_1774525393	1774525393	ok	archive	0.15156039595603943	128	topk	12				/root/sparsify-ascend/checkpoints/research_agent/round_0007/round0007_standard_1774525123_dp2_bs1_ga8_ef12_k128_20260326_193849	f934fceaa1271a4c2da589334438f514ce768a56			继续围绕 topk 主线推进，不开新 family，不换优化器，不动 K。本轮唯一主变量仍是学习率：从 1.6e-3 上调到 1.8e-3，回答“signum+topk 的较优 LR 是否仍在 1.6e-3 以上”这个单一问题。	这轮继续遵守单变量原则，并保持主线顺序不变。当前连续多轮上调 LR 均有改善，继续小步上探仍然是最直接的信息增益来源；风险在于可能开始出现收益饱和或曲线震荡，但这正是本轮需要验证的重点，若不再改善，下一轮就有充分依据结束 signum 的 LR 扫描。	/root/sparsify-ascend/research/history/logs/round0007_standard_1774525123.log
r8_1774526254	1774526254	ok	discard	0.7337483763694763	128	topk	12				/root/sparsify-ascend/checkpoints/research_agent/round_0008/round0008_standard_1774525894_dp2_bs1_ga8_ef12_k128_20260326_195140	065dbd22d478c845fad35b95213e190b4fdeb8d7			继续围绕 topk 主线推进，不开新 family，不动 K。本轮按推荐顺序从学习率扫描切到优化器比较；唯一主变量是 OPTIMIZER：从 signum 改为 adam，同时保持 ARCHITECTURE=topk、K=128、EXPANSION_FACTOR=12、LR=1.6e-3 不变。	这轮满足单变量原则，也符合“先调学习率，再换优化器”的主线顺序。风险是 adam 直接沿用 1.6e-3 未必是其最佳 LR，但作为 optimizer 首轮对照这是可接受的，因为它能最大限度隔离优化器效应；若结果有潜力，下一轮再只调 adam 的 LR。	/root/sparsify-ascend/research/history/logs/round0008_standard_1774525894.log
	1774526370	policy_reject	policy_reject												param_only 一次只能改一个主轴；当前同时改了 optimizer, lr		
	1774526440	policy_reject	policy_reject												param_only 一次只能改一个主轴；当前同时改了 optimizer, lr		
r11_1774526887	1774526887	ok	archive	0.15220221877098083	128	topk	12				/root/sparsify-ascend/checkpoints/research_agent/round_0011/round0011_standard_1774526527_dp2_bs1_ga8_ef12_k128_20260326_200213	cdb51d0c97a4213cc6d2741fd0c6e9edf450a9b4			Stay on the topk mainline and do a pure signum learning-rate refinement: keep `ARCHITECTURE=topk`, `OPTIMIZER=signum`, `K=128`, and `EXPANSION_FACTOR=12` fixed, and move `LR` from `1.6e-3` to `1.7e-3` to answer one question about the local peak of the current stable recipe.	This action is compatible with the stricter single-axis validator because only `lr` changes relative to the current topk reference recipe. It also stays within the active family and avoids another policy rejection while still extracting useful curve-shape information near the current best signum regime.	/root/sparsify-ascend/research/history/logs/round0011_standard_1774526527.log
r12_1774527274	1774527274	ok	archive	0.15220940113067627	128	topk	12				/root/sparsify-ascend/checkpoints/research_agent/round_0012/round0012_standard_1774526913_dp2_bs1_ga8_ef12_k128_20260326_200840	b6a4c8f3d39de12a421514a9aadd4a17431e50b7			Continue the topk mainline with one more narrow signum LR refinement: keep `ARCHITECTURE=topk`, `OPTIMIZER=signum`, `K=128`, and `EXPANSION_FACTOR=12` fixed, and raise `LR` from `1.7e-3` to `1.75e-3` to answer whether the best stable point sits between the successful `1.7e-3` run and the degraded `1.8e-3` run.	This stays on the active topk family and changes only the learning-rate axis, which matches the current validator and the round policy. The main risk is that `1.75e-3` may already be too close to the instability boundary seen at `1.8e-3`, but that is exactly the single question this round is meant to resolve.	/root/sparsify-ascend/research/history/logs/round0012_standard_1774526913.log
	1774527318	policy_reject	policy_reject												当前实际改动主轴是 lr，primary_variable 不应写 other_param		
r14_1774528071	1774528071	ok	archive	0.1526305377483368	128	topk	12				/root/sparsify-ascend/checkpoints/research_agent/round_0014/round0014_standard_1774527350_dp2_bs1_ga8_ef12_k128_20260326_201557	a178cc69869a9d69acb2cc1c06e385edf3790a1d			Run a single loss-axis test on the existing topk mainline: keep `ARCHITECTURE=topk`, `OPTIMIZER=signum`, `K=128`, `EXPANSION_FACTOR=12`, and `LR=1.6e-3` fixed, and lower `AUXK_ALPHA` to `0.015625` to see whether the current recipe is over-regularized.	This avoids the previous policy-reject by anchoring all core axes to the current reference recipe and changing only one non-core parameter. It also follows the prescribed order better than moving K now, since loss shaping has not been isolated yet on the accepted `1.6e-3` mainline.	/root/sparsify-ascend/research/history/logs/round0014_standard_1774527350.log
r15_1774528459	1774528459	ok	keep	0.19926083087921143	64	topk	12				/root/sparsify-ascend/checkpoints/research_agent/round_0015/round0015_standard_1774528099_dp2_bs1_ga8_ef12_k64_20260326_202825	60e72fd464fe928452bd5365b6c1fa4af6470d14			Move to the K axis on the stabilized topk mainline: keep `ARCHITECTURE=topk`, `OPTIMIZER=signum`, `LR=1.6e-3`, and `EXPANSION_FACTOR=12` fixed, and set `K=64` to measure the first real quality-cost tradeoff point in the allowed K set.	This stays within the active `topk` family, changes exactly one primary variable, and follows the repo's own K-coverage guidance once LR and one loss-axis check have been explored. The main risk is a noticeable FVU jump at `K=64`, but that is now the relevant question because LUTurbo cares about total online cost, not only the K128 quality anchor.	/root/sparsify-ascend/research/history/logs/round0015_standard_1774528099.log
r16_1774528847	1774528847	ok	keep	0.24942675232887268	32	topk	12				/root/sparsify-ascend/checkpoints/research_agent/round_0016/round0016_standard_1774528487_dp2_bs1_ga8_ef12_k32_20260326_203453	0b4cd0cbe6779ce8757a374b6643c3b2366abaae			Continue the topk low-K tradeoff lane: keep `ARCHITECTURE=topk`, `OPTIMIZER=signum`, `LR=1.6e-3`, and `EXPANSION_FACTOR=12` fixed, and reduce `K` from `64` to `32` to test whether a materially cheaper decomposition still yields an acceptable reconstruction curve.	This stays on the active topk family, changes exactly one primary variable, and follows directly from the new `K=64` keep result. The main risk is a sharp FVU jump at `K=32`, but mapping that boundary is now more valuable than more K128 recipe polishing because LUTurbo's objective is total online cost, not only anchor quality.	/root/sparsify-ascend/research/history/logs/round0016_standard_1774528487.log
r17_1774529309	1774529309	ok	keep	0.2722620368003845	24	topk	12				/root/sparsify-ascend/checkpoints/research_agent/round_0017/round0017_standard_1774528949_dp2_bs1_ga8_ef12_k24_20260326_204236	8049331c5e26b32b4f9bc659e573199107d3c1c3			Continue the active topk low-K lane: keep `ARCHITECTURE=topk`, `OPTIMIZER=signum`, `LR=1.6e-3`, and `EXPANSION_FACTOR=12` fixed, and reduce `K` from `32` to `24` to test whether the frontier still extends to a cheaper decomposition without an unacceptable reconstruction jump.	This stays on the active mainline family, changes exactly one primary variable (`k`), respects the fixed `EF=12` rule, and follows directly from the observed K-lane evidence. The main risk is that `K=32 -> 24` may cross the practical quality boundary, but the K32 curve still improved smoothly through the end, so a finer step to `24` is more defensible than jumping straight to `16`.	/root/sparsify-ascend/research/history/logs/round0017_standard_1774528949.log
r18_1774529734	1774529734	ok	keep	0.3084372282028198	16	topk	12				/root/sparsify-ascend/checkpoints/research_agent/round_0018/round0018_standard_1774529373_dp2_bs1_ga8_ef12_k16_20260326_204940	6887fe8d83ce0ad6bcd1286983ab927c40057264			Continue the active topk low-K frontier mapping: keep `ARCHITECTURE=topk`, `OPTIMIZER=signum`, `LR=1.6e-3`, and `EXPANSION_FACTOR=12` fixed, and reduce `K` from `24` to `16` to test whether the deployable cost-quality frontier extends one more step down.	This stays on the active `topk` mainline, changes exactly one primary variable (`k`), respects the fixed `EF=12` and allowed-K constraints, and follows directly from the observed curve shape at `K=24`. The main risk is a steeper quality drop and higher dead-feature pressure at `K=16`, but `K=24` still showed smooth late improvement, so the next informative single question is whether the frontier boundary is at `K=16` or below `K=24`.	/root/sparsify-ascend/research/history/logs/round0018_standard_1774529373.log
r19_1774530135	1774530135	ok	keep	0.380331814289093	8	topk	12				/root/sparsify-ascend/checkpoints/research_agent/round_0019/round0019_standard_1774529775_dp2_bs1_ga8_ef12_k8_20260326_205621	8ecdaf1e971dec7f81eac3ef8e6c9f4a85282331			Continue the active topk low-K boundary search: keep `ARCHITECTURE=topk`, `OPTIMIZER=signum`, `LR=1.6e-3`, and `EXPANSION_FACTOR=12` fixed, and reduce `K` from `16` to `8` to test whether the practical LUTurbo cost-quality frontier extends below `K=16`.	This stays on the active `topk` family, changes exactly one primary variable (`k`), respects the fixed `EF=12` rule and allowed-K set, and follows directly from the observed `K=16` curve shape. The main risk is that `K=8` may push the recipe past the useful regime, but `K=16` still improved through the end rather than hard-plateauing, so the next clean question is whether the true boundary sits at `K=8` or between `8` and `16`.	/root/sparsify-ascend/research/history/logs/round0019_standard_1774529775.log
r20_1774530608	1774530608	ok	keep	0.4627891778945923	4	topk	12				/root/sparsify-ascend/checkpoints/research_agent/round_0020/round0020_standard_1774530188_dp2_bs1_ga8_ef12_k4_20260326_210314	ee7dafe6486ceac1a8a549b822b0fc5d578f827a			Finish the current low-K boundary sweep on the active topk mainline: keep `ARCHITECTURE=topk`, `OPTIMIZER=signum`, `LR=1.6e-3`, and `EXPANSION_FACTOR=12` fixed, and reduce `K` from `8` to `4` to locate the hard lower bound of the present topk/signum regime.	"This stays on the active `topk` family, changes exactly one primary variable (`k`), respects the fixed `EF=12` rule and allowed-K set, and closes the current K-only frontier scan cleanly. The main risk is that `K=4` may be clearly past the useful regime, but `command=""stop""` is disallowed and this is the most informative remaining single-variable question because it determines whether `K=8` is merely weak or already beyond the practical floor."	/root/sparsify-ascend/research/history/logs/round0020_standard_1774530188.log
r21_1774531150	1774531150	ok	keep	0.1718563437461853	96	topk	12				/root/sparsify-ascend/checkpoints/research_agent/round_0021/round0021_standard_1774530670_dp2_bs1_ga8_ef12_k96_20260326_211116	1c1aa755d5419c692f23300d92a69b49d3fe4d7b			Shift the K sweep from the collapsed extreme low end to the unexplored moderate-cost region: keep `ARCHITECTURE=topk`, `OPTIMIZER=signum`, `LR=1.6e-3`, and `EXPANSION_FACTOR=12` fixed, and set `K=96` to measure whether a near-anchor quality point exists between the current `K=64` and `K=128` frontier points.	This stays on the active `topk` mainline, changes exactly one primary variable (`k`), respects the fixed `EF=12` rule and allowed-K set, and asks a single clean frontier question. The main risk is that `K=96` may add little beyond interpolation, but after `K=4` and `K=8` showed strong capacity stress, probing the moderate-K gap is a more deployment-relevant use of the same single-axis budget than continuing to push or retread the collapsed low end.	/root/sparsify-ascend/research/history/logs/round0021_standard_1774530670.log
	1774531199	policy_reject	policy_reject												当前实际改动主轴是 k，primary_variable 不应写 other_param		
r23_1774531604	1774531604	ok	archive	0.15255779027938843	128	topk	12				/root/sparsify-ascend/checkpoints/research_agent/round_0023/round0023_standard_1774531274_dp2_bs1_ga8_ef12_k128_20260326_212121	951af29d4aa9592cdd15aec81b60cdf50e8d9881			Run a single loss-axis check on the exact topk mainline reference recipe: keep `ARCHITECTURE=topk`, `OPTIMIZER=signum`, `LR=1.6e-3`, `K=128`, and `EXPANSION_FACTOR=12` fixed, and raise `AUXK_ALPHA` to `0.0625` to answer whether the current baseline benefits from stronger auxiliary pressure.	This stays on the active `topk` family, changes no core axis relative to the declared mainline reference recipe, respects the fixed `EF=12` rule, and avoids repeating the invalid Round 22 pattern that mixed a non-core tweak with `K=96`. The main risk is that stronger auxiliary pressure could slightly hurt reconstruction, but after the weaker-aux test already failed on K128, this is the cleanest remaining single-variable loss-shaping question on the true reference backbone.	/root/sparsify-ascend/research/history/logs/round0023_standard_1774531274.log
r24_1774532034	1774532034	ok	archive	0.15272219479084015	128	topk	12				/root/sparsify-ascend/checkpoints/research_agent/round_0024/round0024_standard_1774531644_dp2_bs1_ga8_ef12_k128_20260326_212730	ac72703f7df2d89581aa24bc797acadd89157e95			Run a single loss-schedule test on the exact topk mainline reference recipe: keep `ARCHITECTURE=topk`, `OPTIMIZER=signum`, `LR=1.6e-3`, `K=128`, `EXPANSION_FACTOR=12`, and `AUXK_ALPHA=0.03125` fixed, and reduce `DEAD_FEATURE_THRESHOLD` to `100000` to see whether activating auxiliary rescue earlier helps the K128 baseline.	This stays on the active `topk` family, changes only one non-core variable on the exact reference backbone, respects the fixed `EF=12` rule, and follows directly from the evidence that both weaker and stronger `AUXK_ALPHA` failed to beat the baseline. The main risk is that the threshold change may have little effect over this training horizon, but it is the cleanest remaining single-variable way to probe whether the auxiliary mechanism is mis-timed rather than mis-scaled.	/root/sparsify-ascend/research/history/logs/round0024_standard_1774531644.log
r25_1774532294	1774532294	crash	crash		128	topk	12				/root/sparsify-ascend/checkpoints/research_agent/round_0025/round0025_standard_1774532114_dp2_bs1_ga8_ef12_k128_20260326_213520	b8387d58f20da207e55219054a7685ff526b5a39			Run a clean full baseline on the exact active topk reference recipe. Keep `ARCHITECTURE=topk`, `OPTIMIZER=signum`, `LR=1.6e-3`, `K=128`, and `EXPANSION_FACTOR=12` fixed, and explicitly lock the auxiliary/runtime knobs to their reference values so the next decision is grounded in a fresh comparable curve rather than in two regressed loss-side variants.	This stays on the active family, respects the one-question rule, and follows the stated priority order by re-establishing a clean baseline before more recipe movement. The risk is no frontier gain this round, but with two consecutive non-improving non-core tweaks, re-anchoring the exact reference is the clearest way to avoid compounding noise and to judge later changes by curve shape rather than stale memory.	/root/sparsify-ascend/research/history/logs/round0025_standard_1774532114.log
r26_1774532701	1774532701	ok	archive	0.15279489755630493	128	topk	12				/root/sparsify-ascend/checkpoints/research_agent/round_0026/round0026_standard_1774532341_dp2_bs1_ga8_ef12_k128_20260326_213907	a03b5c6899e2ac4ea8c7619d90ae691c7ba3e3c0			Run a runtime-stabilization check on the exact active topk reference recipe: keep `ARCHITECTURE=topk`, `OPTIMIZER=signum`, `LR=1.6e-3`, `K=128`, `EXPANSION_FACTOR=12`, and the reference aux/runtime knobs fixed, and change only `COMPILE_MODEL` from `1` to `0` to see whether the recent `first_step_timeout` is a compile-path startup issue rather than a recipe issue.	This stays on the active family, answers one blocker-first question, and is the smallest interpretable response to a fresh `first_step_timeout`. The main risk is that disabling compile changes throughput and may slightly affect absolute training dynamics, but right now stable execution is more important than squeezing recipe conclusions out of a run that never reached a trustworthy curve.	/root/sparsify-ascend/research/history/logs/round0026_standard_1774532341.log
r27_1774533104	1774533104	ok	discard	0.15384331345558167	128	topk	12				/root/sparsify-ascend/checkpoints/research_agent/round_0027/round0027_standard_1774532743_dp2_bs1_ga8_ef12_k128_20260326_214550	d6079434971aa86c0952b3108779471baa827934			Continue on the active `topk` family without opening a new family. Keep `ARCHITECTURE=topk`, `OPTIMIZER=signum`, `K=128`, `EXPANSION_FACTOR=12`, and the Round 26 stabilized runtime settings fixed, and reduce `LR` from `1.6e-3` to `1.4e-3` to answer whether the non-compiled clean baseline recovers a smoother curve and lower final FVU with a slightly smaller step size.	This stays on the current mainline family, follows the requested order by returning to the LR axis after the clean-baseline stabilization pass, and changes exactly one core variable. The main risk is that `1.4e-3` was weaker on the earlier compiled path, but the point of this round is specifically to see whether the stabilized `COMPILE_MODEL=0` regime shifts the practical LR sweet spot rather than to assume the old compiled optimum still transfers unchanged.	/root/sparsify-ascend/research/history/logs/round0027_standard_1774532743.log
r28_1774533469	1774533469	ok	discard	11906.30078125	128	whitened_topk	12				/root/sparsify-ascend/checkpoints/research_agent/round_0028/round0028_standard_1774533169_dp2_bs1_ga8_ef12_k128_20260326_215255	8cdf438da529f3da6ba3360cd8bd4f51de64a535			Run one matched architecture probe on `whitened_topk`. Keep `K=128`, `OPTIMIZER=signum`, `LR=1.6e-3`, `EXPANSION_FACTOR=12`, and the current stable non-compiled runtime/aux recipe fixed, and change only `ARCHITECTURE` from `topk` to `whitened_topk` to test whether this directly export-compatible variant is worth continuing as a family.	This follows the Round 28 rule for a single matched architecture probe, changes exactly one primary variable (`architecture`), and chooses a candidate that remains close to LUTurbo's static-vector weighted-sum deployment contract. The main risk is that the preconditioning may add training complexity without improving reconstruction, but that is precisely the yes/no family-worthiness question this probe is meant to answer before returning to the mainline next round.	/root/sparsify-ascend/research/history/logs/round0028_standard_1774533169.log
r29_1774534169	1774534169	ok	keep	0.1498660147190094	128	gated	12				/root/sparsify-ascend/checkpoints/research_agent/round_0029/round0029_standard_1774533509_dp2_bs1_ga8_ef12_k128_20260326_215835	8263c51a85a922edcd5e4b56ef55d4c3719f3e0f			Run one matched architecture probe on `gated`. Keep `K=128`, `OPTIMIZER=signum`, `LR=1.6e-3`, `EXPANSION_FACTOR=12`, and the current stabilized runtime/aux recipe fixed, and change only `ARCHITECTURE` from `topk` to `gated` to test whether this directly export-compatible family is worth continuing.	This obeys the matched-probe rule by changing only the architecture axis, keeps the core mainline recipe fixed, and selects a family that remains compatible with LUTurbo's static-vector weighted-sum deployment contract. The main risk is that the extra gating branch may add training complexity without improving quality or runtime-aligned sparsity behavior, but that is exactly the family-worthiness question this probe is intended to answer before returning to the topk mainline.	/root/sparsify-ascend/research/history/logs/round0029_standard_1774533509.log
	1774534233	policy_reject	policy_reject												不允许 no_change；每一轮都必须提出可执行的实验或修复		
